{
  "$schema": "../../../../schemas/lenses/product-record.schema.json",
  "id": "lensbaby-composer-pro-ii-with-sweet-50-optic",
  "productType": "lens",
  "identity": {
    "manufacturerId": "lensbaby",
    "brandId": "lensbaby",
    "productName": "Lensbaby Composer Pro II with Sweet 50 Optic",
    "modelNumberOptions": null,
    "alternateNames": null,
    "variants": null
  },
  "lifecycle": {
    "announcementDate": null,
    "officialDesignations": []
  },
  "officialProductPages": [
    {
      "url": "https://lensbaby.com/products/composer-pro-ii-with-sweet-50-optic",
      "pageFamilies": [
        "global",
        "usa"
      ],
      "region": null,
      "language": "en",
      "publisher": {
        "type": "manufacturer-or-brand",
        "name": "Lensbaby, Inc."
      }
    }
  ],
  "mount": {
    "systemId": "nikon-z",
    "replaceability": "fixed",
    "mountOwnerRelationship": null,
    "electronicContacts": null
  },
  "physical": {
    "dimensionMeasurements": null,
    "weightMeasurements": null,
    "officialEnvironmentalProtectionClaims": null,
    "filterInterfaces": [
      {
        "type": "front-thread",
        "diameterMm": 46,
        "host": {
          "kind": "product"
        }
      }
    ],
    "tripodSupport": null,
    "externalLengthDuringFocus": null,
    "isRetractableForStorage": null
  },
  "controls": [
    {
      "type": "aperture-ring",
      "quantity": 1
    },
    {
      "type": "focus-ring",
      "quantity": 1
    },
    {
      "type": "other",
      "quantity": 1,
      "officialName": "Locking ring"
    }
  ],
  "accessories": null,
  "electronicServices": null,
  "lens": {
    "focalLength": {
      "kind": "prime",
      "millimeters": 50
    },
    "aperture": {
      "fNumber": {
        "maximumAperture": [
          {
            "value": 2.5,
            "conditions": {}
          }
        ],
        "minimumAperture": [
          {
            "value": 22,
            "conditions": {}
          }
        ],
        "effective": null
      },
      "diaphragm": {
        "present": true,
        "bladeCount": 12,
        "bladeShape": null
      },
      "controlMechanism": "mechanical"
    },
    "anglesOfView": null,
    "coverage": {
      "format": "full-frame"
    },
    "opticalConstruction": {
      "groups": 1,
      "elements": 2
    },
    "specialElements": null,
    "coatings": null,
    "focus": {
      "autofocus": {
        "present": false
      },
      "manualFocus": {
        "present": true,
        "mechanism": null
      },
      "opticalFocusingSystems": null,
      "minimumFocusDistances": [
        {
          "distanceM": 0.381,
          "conditions": {}
        }
      ],
      "reproductionMagnifications": null,
      "officialFocusBehaviorClaims": []
    },
    "stabilization": {
      "present": false
    },
    "specialized": {
      "movements": {
        "tiltMeasurements": [
          {
            "maximumFromNeutralDegrees": 15,
            "totalRangeDegrees": null,
            "directionality": null,
            "conditions": {}
          }
        ]
      }
    }
  }
}
