{
  "$schema": "../../../../schemas/lenses/product-record.schema.json",
  "id": "ttartisan-af-56mm-f1-8",
  "productType": "lens",
  "identity": {
    "manufacturerId": "ttartisan",
    "brandId": "ttartisan",
    "productName": "TTArtisan AF 56mm F1.8",
    "modelNumberOptions": null,
    "alternateNames": null,
    "variants": null
  },
  "lifecycle": {
    "announcementDate": null,
    "officialDesignations": []
  },
  "officialProductPages": [
    {
      "url": "https://en.ttartisan.com/?af-lens%2FAF-56.html=",
      "pageFamilies": [
        "global"
      ],
      "region": null,
      "language": "en",
      "publisher": {
        "type": "manufacturer-or-brand",
        "name": "TTArtisan"
      }
    },
    {
      "url": "https://ttartisan.store/products/56mm",
      "pageFamilies": [
        "usa"
      ],
      "region": null,
      "language": "en",
      "publisher": {
        "type": "manufacturer-or-brand",
        "name": "TTArtisan"
      }
    }
  ],
  "mount": {
    "systemId": "nikon-z",
    "replaceability": "fixed",
    "mountOwnerRelationship": null,
    "electronicContacts": {
      "present": true,
      "metadataTransmission": null
    }
  },
  "physical": {
    "dimensionMeasurements": null,
    "weightMeasurements": null,
    "officialEnvironmentalProtectionClaims": null,
    "filterInterfaces": [
      {
        "type": "front-thread",
        "diameterMm": 52,
        "host": {
          "kind": "product"
        }
      }
    ],
    "tripodSupport": {
      "present": false
    },
    "externalLengthDuringFocus": null,
    "isRetractableForStorage": false
  },
  "controls": null,
  "accessories": {
    "lensHoods": [
      {
        "relationship": "supplied",
        "modelNumberOptions": null,
        "quantity": 1
      }
    ],
    "frontCaps": [
      {
        "relationship": "supplied",
        "modelNumberOptions": null,
        "quantity": 1
      }
    ],
    "rearCaps": [
      {
        "relationship": "supplied",
        "modelNumberOptions": null,
        "quantity": 1
      }
    ],
    "lensCases": null,
    "lensStraps": null,
    "protectiveWraps": null
  },
  "electronicServices": {
    "hasPublishedFirmwareUpdate": null,
    "connections": [
      {
        "method": "dock",
        "connectorType": "usb-c",
        "purposes": [
          "firmware-update"
        ]
      }
    ]
  },
  "lens": {
    "focalLength": {
      "kind": "prime",
      "millimeters": 56
    },
    "aperture": {
      "fNumber": {
        "maximumAperture": [
          {
            "value": 1.8,
            "conditions": {}
          }
        ],
        "minimumAperture": [
          {
            "value": 16,
            "conditions": {}
          }
        ],
        "effective": null
      },
      "diaphragm": {
        "present": true,
        "bladeCount": 9,
        "bladeShape": null
      },
      "controlMechanism": "electronic"
    },
    "anglesOfView": [
      {
        "format": "aps-c",
        "orientation": null,
        "degrees": 28,
        "conditions": {}
      }
    ],
    "coverage": {
      "format": "aps-c"
    },
    "opticalConstruction": {
      "groups": 9,
      "elements": 10
    },
    "specialElements": [
      {
        "types": [
          "high-refractive-index"
        ],
        "quantity": 2
      },
      {
        "types": [
          "low-dispersion"
        ],
        "quantity": 1
      }
    ],
    "coatings": null,
    "focus": {
      "autofocus": {
        "present": true,
        "motors": [
          {
            "type": "stepping-motor",
            "quantity": null,
            "officialName": "STM"
          }
        ]
      },
      "manualFocus": null,
      "opticalFocusingSystems": null,
      "minimumFocusDistances": [
        {
          "distanceM": 0.8,
          "conditions": {}
        }
      ],
      "reproductionMagnifications": null,
      "officialFocusBehaviorClaims": []
    },
    "stabilization": {
      "present": false
    },
    "specialized": {}
  }
}
