{
  "$schema": "../../../../schemas/lenses/product-record.schema.json",
  "id": "meike-12mm-f2-8-aps-c-lens",
  "productType": "lens",
  "identity": {
    "manufacturerId": "meike",
    "brandId": "meike",
    "productName": "Meike 12mm F2.8 APS-C Lens",
    "modelNumberOptions": null,
    "alternateNames": null,
    "variants": null
  },
  "lifecycle": {
    "announcementDate": null,
    "officialDesignations": []
  },
  "officialProductPages": [
    {
      "url": "https://meikeglobal.com/products/meike-12mm-f-2-8-ultra-wide-angle-fixed-aps-c-lens-with-removeable-hood-fit-fujifilm-x-mount-mirrorless-aps-c-camera-x-t3-x-t100-x-pro2-x-e3-x-t1-x-t2-x-t10-x-t20-x-a2-x-e2-x-e1-x30-x70-x-m1-xpro1-etc",
      "pageFamilies": [
        "global",
        "usa"
      ],
      "region": null,
      "language": "en",
      "publisher": {
        "type": "manufacturer-or-brand",
        "name": "Meike"
      }
    }
  ],
  "mount": {
    "systemId": "nikon-z",
    "replaceability": "fixed",
    "mountOwnerRelationship": null,
    "electronicContacts": {
      "present": false
    }
  },
  "physical": {
    "dimensionMeasurements": [
      {
        "maximumDiameterMm": 78,
        "lengthMm": 65.8,
        "conditions": {}
      }
    ],
    "weightMeasurements": [
      {
        "grams": 360,
        "conditions": {
          "attachedComponents": []
        }
      }
    ],
    "officialEnvironmentalProtectionClaims": null,
    "filterInterfaces": [
      {
        "type": "front-thread",
        "diameterMm": 72,
        "host": {
          "kind": "product"
        }
      }
    ],
    "tripodSupport": {
      "present": false
    },
    "externalLengthDuringFocus": null,
    "isRetractableForStorage": false
  },
  "controls": null,
  "accessories": null,
  "lens": {
    "focalLength": {
      "kind": "prime",
      "millimeters": 12
    },
    "aperture": {
      "fNumber": {
        "maximumAperture": [
          {
            "value": 2.8,
            "conditions": {}
          }
        ],
        "minimumAperture": [
          {
            "value": 22,
            "conditions": {}
          }
        ],
        "effective": null
      },
      "diaphragm": {
        "present": true,
        "bladeCount": 9,
        "bladeShape": null
      },
      "controlMechanism": "mechanical"
    },
    "anglesOfView": [
      {
        "format": "aps-c",
        "orientation": null,
        "degrees": 99,
        "conditions": {}
      }
    ],
    "coverage": {
      "format": "aps-c"
    },
    "opticalConstruction": {
      "groups": 10,
      "elements": 12
    },
    "specialElements": null,
    "coatings": null,
    "focus": {
      "autofocus": {
        "present": false
      },
      "manualFocus": {
        "present": true,
        "mechanism": "mechanical-coupled"
      },
      "opticalFocusingSystems": null,
      "minimumFocusDistances": null,
      "reproductionMagnifications": null,
      "officialFocusBehaviorClaims": []
    },
    "stabilization": {
      "present": false
    },
    "specialized": {}
  }
}
