{
  "$schema": "../../../../schemas/lenses/product-record.schema.json",
  "id": "cheecar-12mm-f2-mark-ii",
  "productType": "lens",
  "identity": {
    "manufacturerId": "cheecar",
    "brandId": "cheecar",
    "productName": "Cheecar 12mm F2 Mark II",
    "modelNumberOptions": null,
    "alternateNames": null,
    "variants": null
  },
  "lifecycle": {
    "announcementDate": null,
    "officialDesignations": []
  },
  "officialProductPages": [
    {
      "url": "http://cheecar.com/product-42292-37595-183611.html",
      "pageFamilies": [
        "home-country"
      ],
      "region": "CN",
      "language": "zh",
      "publisher": {
        "type": "manufacturer-or-brand",
        "name": "Cheecar"
      }
    }
  ],
  "mount": {
    "systemId": "nikon-z",
    "replaceability": "fixed",
    "mountOwnerRelationship": null,
    "electronicContacts": {
      "present": false
    }
  },
  "physical": {
    "dimensionMeasurements": [
      {
        "maximumDiameterMm": 46.5,
        "lengthMm": 51.5,
        "conditions": {}
      }
    ],
    "weightMeasurements": [
      {
        "grams": 229,
        "approximate": true,
        "conditions": {
          "attachedComponents": []
        }
      }
    ],
    "officialEnvironmentalProtectionClaims": null,
    "filterInterfaces": [
      {
        "type": "front-thread",
        "diameterMm": 62,
        "host": {
          "kind": "accessory",
          "category": "other",
          "modelNumberOptions": null
        }
      }
    ],
    "tripodSupport": {
      "present": false
    },
    "isRetractableForStorage": false,
    "externalLengthDuringFocus": null
  },
  "controls": [
    {
      "type": "focus-ring",
      "quantity": 1
    },
    {
      "type": "aperture-ring",
      "quantity": 1,
      "clickBehavior": "clicked"
    },
    {
      "type": "focus-distance-scale",
      "quantity": 1
    },
    {
      "type": "depth-of-field-scale",
      "quantity": 1
    }
  ],
  "accessories": null,
  "lens": {
    "focalLength": {
      "kind": "prime",
      "millimeters": 12
    },
    "aperture": {
      "fNumber": {
        "maximumAperture": [
          {
            "value": 2,
            "conditions": {}
          }
        ],
        "minimumAperture": [
          {
            "value": 22,
            "conditions": {}
          }
        ],
        "effective": null
      },
      "diaphragm": {
        "present": true,
        "bladeCount": 10,
        "bladeShape": null
      },
      "controlMechanism": "mechanical"
    },
    "anglesOfView": [
      {
        "format": "aps-c",
        "orientation": null,
        "degrees": 97,
        "conditions": {}
      }
    ],
    "coverage": {
      "format": "aps-c"
    },
    "opticalConstruction": {
      "groups": 9,
      "elements": 12
    },
    "specialElements": [
      {
        "types": [
          "aspherical"
        ],
        "quantity": 2,
        "officialName": "非球面"
      },
      {
        "types": [
          "low-dispersion"
        ],
        "quantity": 2,
        "officialName": "ED"
      },
      {
        "types": [
          "high-refractive-index"
        ],
        "quantity": 3,
        "officialName": "高折射率"
      }
    ],
    "coatings": [
      {
        "types": [
          "anti-reflective"
        ],
        "appliedTo": null
      }
    ],
    "focus": {
      "autofocus": {
        "present": false
      },
      "manualFocus": {
        "present": true,
        "mechanism": "mechanical-coupled"
      },
      "opticalFocusingSystems": null,
      "minimumFocusDistances": [
        {
          "distanceM": 0.2,
          "conditions": {}
        }
      ],
      "reproductionMagnifications": null,
      "officialFocusBehaviorClaims": null
    },
    "stabilization": {
      "present": false
    },
    "specialized": {}
  }
}
