{
  "$schema": "../../../../schemas/lenses/product-record.schema.json",
  "id": "7artisans-mf-18mm-f6p3-mark-ii",
  "productType": "lens",
  "identity": {
    "manufacturerId": "7artisans",
    "brandId": "7artisans",
    "productName": "MF 18mm f/6.3 Mark II APS-C Lens",
    "modelNumberOptions": null,
    "alternateNames": null,
    "variants": null
  },
  "lifecycle": {
    "announcementDate": null,
    "officialDesignations": []
  },
  "officialProductPages": [
    {
      "url": "https://7artisans.store/products/18mm-f-6-3-mark-ii-aps-c-lens-for-sony-e-fujifilm-x-nikon-z",
      "pageFamilies": [
        "global",
        "usa"
      ],
      "region": null,
      "language": "en",
      "publisher": {
        "type": "manufacturer-or-brand",
        "name": "7Artisans"
      }
    },
    {
      "url": "https://7artisans.store/ja/products/18mm-f-6-3-mark-ii-aps-c-lens-for-sony-e-fujifilm-x-nikon-z",
      "pageFamilies": [
        "japan"
      ],
      "region": "JP",
      "language": "ja",
      "publisher": {
        "type": "manufacturer-or-brand",
        "name": "7Artisans"
      }
    }
  ],
  "mount": {
    "systemId": "nikon-z",
    "replaceability": "fixed",
    "mountOwnerRelationship": null,
    "electronicContacts": {
      "present": false
    }
  },
  "physical": {
    "dimensionMeasurements": null,
    "weightMeasurements": null,
    "officialEnvironmentalProtectionClaims": null,
    "filterInterfaces": [],
    "tripodSupport": {
      "present": false
    },
    "externalLengthDuringFocus": null,
    "isRetractableForStorage": null
  },
  "controls": null,
  "accessories": null,
  "lens": {
    "focalLength": {
      "kind": "prime",
      "millimeters": 18
    },
    "aperture": {
      "fNumber": {
        "maximumAperture": [
          {
            "value": 6.3,
            "conditions": {}
          }
        ],
        "minimumAperture": [
          {
            "value": 6.3,
            "conditions": {}
          }
        ],
        "effective": null
      },
      "diaphragm": {
        "present": false
      },
      "controlMechanism": "mechanical"
    },
    "anglesOfView": null,
    "coverage": {
      "format": "aps-c"
    },
    "opticalConstruction": {
      "groups": 5,
      "elements": 6
    },
    "specialElements": null,
    "coatings": null,
    "focus": {
      "autofocus": {
        "present": false
      },
      "manualFocus": {
        "present": true,
        "mechanism": "mechanical-coupled"
      },
      "opticalFocusingSystems": null,
      "minimumFocusDistances": [
        {
          "distanceM": 0.3,
          "conditions": {}
        }
      ],
      "reproductionMagnifications": null,
      "officialFocusBehaviorClaims": []
    },
    "stabilization": {
      "present": false
    },
    "specialized": {}
  }
}
