{
  "$schema": "../../../../schemas/lenses/product-record.schema.json",
  "id": "brightin-star-af-35mm-f1p8",
  "productType": "lens",
  "identity": {
    "manufacturerId": "brightin-star",
    "brandId": "brightin-star",
    "productName": "AF 35mm F1.8 Full-Frame Prime Lens",
    "modelNumberOptions": null,
    "alternateNames": null,
    "variants": null
  },
  "lifecycle": {
    "announcementDate": null,
    "officialDesignations": []
  },
  "officialProductPages": [
    {
      "url": "https://brightinstar.com/products/af-35mm-f1-8-full-frame-prime-lens",
      "pageFamilies": [
        "global",
        "usa"
      ],
      "region": null,
      "language": "en",
      "publisher": {
        "type": "manufacturer-or-brand",
        "name": "BRIGHTIN STAR"
      }
    }
  ],
  "mount": {
    "systemId": "nikon-z",
    "replaceability": "fixed",
    "mountOwnerRelationship": null,
    "electronicContacts": {
      "present": true,
      "metadataTransmission": {
        "present": true,
        "standards": [
          "exif"
        ]
      }
    }
  },
  "physical": {
    "dimensionMeasurements": [
      {
        "maximumDiameterMm": 75,
        "lengthMm": 90,
        "approximate": true,
        "conditions": {}
      }
    ],
    "weightMeasurements": [
      {
        "grams": 430,
        "approximate": true,
        "conditions": {
          "attachedComponents": []
        }
      }
    ],
    "officialEnvironmentalProtectionClaims": null,
    "filterInterfaces": [
      {
        "type": "front-thread",
        "diameterMm": 62,
        "host": {
          "kind": "product"
        }
      }
    ],
    "tripodSupport": {
      "present": false
    },
    "externalLengthDuringFocus": null,
    "isRetractableForStorage": false
  },
  "controls": [
    {
      "type": "focus-mode-switch",
      "quantity": 1
    }
  ],
  "accessories": null,
  "electronicServices": {
    "hasPublishedFirmwareUpdate": true,
    "connections": [
      {
        "method": "direct-usb",
        "connectorType": "usb-c",
        "purposes": [
          "firmware-update"
        ]
      }
    ]
  },
  "lens": {
    "focalLength": {
      "kind": "prime",
      "millimeters": 35
    },
    "aperture": {
      "fNumber": {
        "maximumAperture": [
          {
            "value": 1.8,
            "conditions": {}
          }
        ],
        "minimumAperture": [
          {
            "value": 16,
            "conditions": {}
          }
        ],
        "effective": null
      },
      "diaphragm": {
        "present": true,
        "bladeCount": 11,
        "bladeShape": null
      },
      "controlMechanism": "electronic"
    },
    "anglesOfView": [
      {
        "format": "full-frame",
        "orientation": null,
        "degrees": 63.9,
        "conditions": {}
      }
    ],
    "coverage": {
      "format": "full-frame"
    },
    "opticalConstruction": {
      "groups": 8,
      "elements": 11
    },
    "specialElements": [
      {
        "types": [
          "high-refractive-index"
        ],
        "quantity": 3,
        "officialName": "High-refractive"
      },
      {
        "types": [
          "low-dispersion"
        ],
        "quantity": 2,
        "officialName": "Low-dispersion"
      }
    ],
    "coatings": null,
    "focus": {
      "autofocus": {
        "present": true,
        "motors": [
          {
            "type": "stepping-motor",
            "quantity": null,
            "officialName": "STM"
          }
        ]
      },
      "manualFocus": {
        "present": true,
        "mechanism": "electronic-by-wire"
      },
      "opticalFocusingSystems": null,
      "minimumFocusDistances": [
        {
          "distanceM": 0.4,
          "conditions": {}
        }
      ],
      "reproductionMagnifications": null,
      "officialFocusBehaviorClaims": [
        {
          "type": "focus-breathing-suppressed",
          "conditions": {}
        }
      ]
    },
    "stabilization": {
      "present": false
    },
    "specialized": {}
  }
}
