{
  "$schema": "../../../../schemas/lenses/product-record.schema.json",
  "id": "artralab-lunaelumen-50mm-f1p1",
  "productType": "lens",
  "identity": {
    "manufacturerId": "artra-lab",
    "brandId": "artra-lab",
    "productName": "50mm F1.1 LUNAELUMEN",
    "modelNumberOptions": null,
    "alternateNames": null,
    "variants": null
  },
  "lifecycle": {
    "announcementDate": null,
    "officialDesignations": []
  },
  "officialProductPages": [
    {
      "url": "https://artralab.com/products/custom-made-version-artra-lab-50mm-f1-1-lunaelumen-lenses",
      "pageFamilies": [
        "home-country",
        "global"
      ],
      "region": null,
      "language": "en",
      "publisher": {
        "type": "manufacturer-or-brand",
        "name": "Artra Lab"
      }
    }
  ],
  "mount": {
    "systemId": "nikon-z",
    "replaceability": "fixed",
    "mountOwnerRelationship": null,
    "electronicContacts": {
      "present": false
    }
  },
  "physical": {
    "dimensionMeasurements": [
      {
        "maximumDiameterMm": 62.9,
        "lengthMm": 67.88,
        "conditions": {}
      }
    ],
    "weightMeasurements": [
      {
        "grams": 418,
        "conditions": {
          "attachedComponents": []
        }
      }
    ],
    "officialEnvironmentalProtectionClaims": null,
    "filterInterfaces": [
      {
        "type": "front-thread",
        "diameterMm": 52,
        "host": {
          "kind": "product"
        }
      }
    ],
    "tripodSupport": {
      "present": false
    },
    "externalLengthDuringFocus": null,
    "isRetractableForStorage": null
  },
  "controls": null,
  "accessories": null,
  "lens": {
    "focalLength": {
      "kind": "prime",
      "millimeters": 50
    },
    "aperture": {
      "fNumber": {
        "maximumAperture": [
          {
            "value": 1.1,
            "conditions": {}
          }
        ],
        "minimumAperture": [
          {
            "value": 16,
            "conditions": {}
          }
        ],
        "effective": null
      },
      "diaphragm": {
        "present": true,
        "bladeCount": 11,
        "bladeShape": null
      },
      "controlMechanism": "mechanical"
    },
    "anglesOfView": [
      {
        "format": "full-frame",
        "orientation": null,
        "degrees": 46,
        "conditions": {}
      }
    ],
    "coverage": {
      "format": "full-frame"
    },
    "opticalConstruction": {
      "groups": 6,
      "elements": 8
    },
    "specialElements": null,
    "coatings": null,
    "focus": {
      "autofocus": {
        "present": false
      },
      "manualFocus": {
        "present": true,
        "mechanism": "mechanical-coupled"
      },
      "opticalFocusingSystems": null,
      "minimumFocusDistances": [
        {
          "distanceM": 0.7,
          "conditions": {}
        }
      ],
      "reproductionMagnifications": null,
      "officialFocusBehaviorClaims": []
    },
    "stabilization": {
      "present": false
    },
    "specialized": {}
  }
}
