{
  "$schema": "../../../../schemas/lenses/product-record.schema.json",
  "id": "viltrox-af-35mm-f1p7-air",
  "productType": "lens",
  "identity": {
    "manufacturerId": "viltrox",
    "brandId": "viltrox",
    "productName": "AF 35mm F1.7 Air",
    "modelNumberOptions": null,
    "alternateNames": null,
    "variants": null
  },
  "lifecycle": {
    "announcementDate": null,
    "officialDesignations": []
  },
  "officialProductPages": [
    {
      "url": "https://viltrox.com/products/viltrox-af-35mm-f1-7-aps-c-lens-for-nikon-z-mount",
      "pageFamilies": [
        "global"
      ],
      "region": null,
      "language": "en",
      "publisher": {
        "type": "manufacturer-or-brand",
        "name": "Viltrox"
      }
    }
  ],
  "mount": {
    "systemId": "nikon-z",
    "replaceability": "fixed",
    "mountOwnerRelationship": null,
    "electronicContacts": {
      "present": true,
      "metadataTransmission": {
        "present": true,
        "standards": [
          "exif"
        ]
      }
    }
  },
  "physical": {
    "dimensionMeasurements": [
      {
        "maximumDiameterMm": 64,
        "lengthMm": 56.4,
        "conditions": {}
      }
    ],
    "weightMeasurements": [
      {
        "grams": 180,
        "conditions": {
          "attachedComponents": []
        },
        "approximate": true
      }
    ],
    "officialEnvironmentalProtectionClaims": [
      {
        "types": [
          "waterproof",
          "other"
        ],
        "scope": {
          "kind": "component",
          "component": "front element"
        },
        "conditions": {}
      }
    ],
    "filterInterfaces": [
      {
        "type": "front-thread",
        "diameterMm": 52,
        "host": {
          "kind": "product"
        }
      }
    ],
    "tripodSupport": {
      "present": false
    },
    "externalLengthDuringFocus": "constant",
    "isRetractableForStorage": false
  },
  "controls": null,
  "accessories": null,
  "electronicServices": {
    "hasPublishedFirmwareUpdate": true,
    "connections": [
      {
        "method": "direct-usb",
        "purposes": [
          "firmware-update"
        ]
      }
    ]
  },
  "lens": {
    "focalLength": {
      "kind": "prime",
      "millimeters": 35
    },
    "aperture": {
      "fNumber": {
        "maximumAperture": [
          {
            "value": 1.7,
            "conditions": {}
          }
        ],
        "minimumAperture": [
          {
            "value": 16,
            "conditions": {}
          }
        ],
        "effective": null
      },
      "diaphragm": {
        "present": true,
        "bladeCount": 9,
        "bladeShape": null
      },
      "controlMechanism": "electronic"
    },
    "anglesOfView": [
      {
        "format": "aps-c",
        "orientation": null,
        "degrees": 45,
        "conditions": {}
      }
    ],
    "coverage": {
      "format": "aps-c"
    },
    "opticalConstruction": {
      "groups": 9,
      "elements": 11
    },
    "specialElements": [
      {
        "types": [
          "low-dispersion"
        ],
        "quantity": 1,
        "officialName": "ED"
      },
      {
        "types": [
          "aspherical"
        ],
        "quantity": 1,
        "officialName": "Aspherical"
      },
      {
        "types": [
          "high-refractive-index"
        ],
        "quantity": 2,
        "officialName": "HR"
      }
    ],
    "coatings": [
      {
        "types": [
          "anti-reflective"
        ],
        "appliedTo": null
      },
      {
        "types": [
          "surface-protective"
        ],
        "appliedTo": [
          "front-element"
        ]
      }
    ],
    "focus": {
      "autofocus": {
        "present": true,
        "motors": [
          {
            "type": "stepping-motor",
            "officialName": "STM+Lead screw",
            "quantity": null
          }
        ]
      },
      "manualFocus": {
        "present": true,
        "mechanism": null
      },
      "opticalFocusingSystems": [
        {
          "type": "internal-focusing",
          "officialName": "Internal focus"
        }
      ],
      "minimumFocusDistances": [
        {
          "distanceM": 0.33,
          "conditions": {}
        }
      ],
      "reproductionMagnifications": [
        {
          "kind": "maximum",
          "value": 0.13,
          "conditions": {}
        }
      ],
      "officialFocusBehaviorClaims": [
        {
          "type": "focus-breathing-suppressed",
          "conditions": {}
        }
      ]
    },
    "stabilization": {
      "present": false
    },
    "specialized": {}
  }
}
