{
  "$schema": "../../../../schemas/lenses/product-record.schema.json",
  "id": "brightin-star-mf-9mm-f5p6",
  "productType": "lens",
  "identity": {
    "manufacturerId": "brightin-star",
    "brandId": "brightin-star",
    "productName": "9mm F5.6 Full Frame Ultra Wide Angle Manual Focus Lens",
    "modelNumberOptions": null,
    "alternateNames": null,
    "variants": null
  },
  "lifecycle": {
    "announcementDate": null,
    "officialDesignations": []
  },
  "officialProductPages": [
    {
      "url": "https://brightinstar.com/products/brightin-star-9mm-f5-6-full-frame-camera-lens-for-sony-e-nikon-z-canon-rf-l-mount",
      "pageFamilies": [
        "global",
        "usa"
      ],
      "region": null,
      "language": "en",
      "publisher": {
        "type": "manufacturer-or-brand",
        "name": "BRIGHTIN STAR"
      }
    }
  ],
  "mount": {
    "systemId": "nikon-z",
    "replaceability": "fixed",
    "mountOwnerRelationship": null,
    "electronicContacts": {
      "present": false
    }
  },
  "physical": {
    "dimensionMeasurements": [
      {
        "maximumDiameterMm": 64,
        "lengthMm": 87.8,
        "conditions": {}
      }
    ],
    "weightMeasurements": null,
    "officialEnvironmentalProtectionClaims": null,
    "filterInterfaces": [
      {
        "type": "rear-thread",
        "diameterMm": 34,
        "host": {
          "kind": "product"
        }
      }
    ],
    "tripodSupport": {
      "present": false
    },
    "externalLengthDuringFocus": null,
    "isRetractableForStorage": false
  },
  "controls": null,
  "accessories": null,
  "lens": {
    "focalLength": {
      "kind": "prime",
      "millimeters": 9
    },
    "aperture": {
      "fNumber": {
        "maximumAperture": [
          {
            "value": 5.6,
            "conditions": {}
          }
        ],
        "minimumAperture": [
          {
            "value": 22,
            "conditions": {}
          }
        ],
        "effective": null
      },
      "diaphragm": {
        "present": true,
        "bladeCount": 5,
        "bladeShape": null
      },
      "controlMechanism": "mechanical"
    },
    "anglesOfView": [
      {
        "format": "full-frame",
        "orientation": "diagonal",
        "degrees": 132,
        "conditions": {}
      },
      {
        "format": "full-frame",
        "orientation": "horizontal",
        "degrees": 123.5,
        "conditions": {}
      },
      {
        "format": "full-frame",
        "orientation": "vertical",
        "degrees": 101.2,
        "conditions": {}
      }
    ],
    "coverage": {
      "format": "full-frame"
    },
    "opticalConstruction": null,
    "specialElements": [
      {
        "types": [
          "aspherical"
        ],
        "quantity": 2,
        "officialName": "Aspherical"
      },
      {
        "types": [
          "low-dispersion"
        ],
        "quantity": 2,
        "officialName": "ED"
      },
      {
        "types": [
          "high-refractive-index"
        ],
        "quantity": 3,
        "officialName": "High-refractive"
      }
    ],
    "coatings": null,
    "focus": {
      "autofocus": {
        "present": false
      },
      "manualFocus": {
        "present": true,
        "mechanism": "mechanical-coupled"
      },
      "opticalFocusingSystems": null,
      "minimumFocusDistances": [
        {
          "distanceM": 0.2,
          "conditions": {}
        }
      ],
      "reproductionMagnifications": null,
      "officialFocusBehaviorClaims": []
    },
    "stabilization": {
      "present": false
    },
    "specialized": {}
  }
}
