{
  "$schema": "../../../../schemas/lenses/product-record.schema.json",
  "id": "ttartisan-40mm-f2-8-macro",
  "productType": "lens",
  "identity": {
    "manufacturerId": "ttartisan",
    "brandId": "ttartisan",
    "productName": "TTArtisan 40mm F2.8 Macro",
    "modelNumberOptions": null,
    "alternateNames": null,
    "variants": null
  },
  "lifecycle": {
    "announcementDate": null,
    "officialDesignations": []
  },
  "officialProductPages": [
    {
      "url": "https://en.ttartisan.com/?aps-c-lenses%2F75.html=",
      "pageFamilies": [
        "global"
      ],
      "region": null,
      "language": "en",
      "publisher": {
        "type": "manufacturer-or-brand",
        "name": "TTArtisan"
      }
    },
    {
      "url": "https://ttartisan.store/products/aps-c-40mm-f2-8-marco",
      "pageFamilies": [
        "usa"
      ],
      "region": null,
      "language": "en",
      "publisher": {
        "type": "manufacturer-or-brand",
        "name": "TTArtisan"
      }
    }
  ],
  "mount": {
    "systemId": "nikon-z",
    "replaceability": "fixed",
    "mountOwnerRelationship": null,
    "electronicContacts": {
      "present": false
    }
  },
  "physical": {
    "dimensionMeasurements": null,
    "weightMeasurements": null,
    "officialEnvironmentalProtectionClaims": null,
    "filterInterfaces": [
      {
        "type": "front-thread",
        "diameterMm": 52,
        "host": {
          "kind": "product"
        }
      }
    ],
    "tripodSupport": {
      "present": false
    },
    "externalLengthDuringFocus": null,
    "isRetractableForStorage": false
  },
  "controls": [
    {
      "type": "focus-distance-scale",
      "quantity": 1
    },
    {
      "type": "depth-of-field-scale",
      "quantity": 1
    },
    {
      "type": "aperture-ring",
      "quantity": 1,
      "clickBehavior": "clicked"
    }
  ],
  "accessories": {
    "lensHoods": null,
    "frontCaps": [
      {
        "relationship": "supplied",
        "modelNumberOptions": null,
        "quantity": 1
      }
    ],
    "rearCaps": [
      {
        "relationship": "supplied",
        "modelNumberOptions": null,
        "quantity": 1
      }
    ],
    "lensCases": null,
    "lensStraps": null,
    "protectiveWraps": null
  },
  "lens": {
    "focalLength": {
      "kind": "prime",
      "millimeters": 40
    },
    "aperture": {
      "fNumber": {
        "maximumAperture": [
          {
            "value": 2.8,
            "conditions": {}
          }
        ],
        "minimumAperture": [
          {
            "value": 16,
            "conditions": {}
          }
        ],
        "effective": null
      },
      "diaphragm": {
        "present": true,
        "bladeCount": 11,
        "bladeShape": null
      },
      "controlMechanism": "mechanical"
    },
    "anglesOfView": [
      {
        "format": "aps-c",
        "orientation": null,
        "degrees": 40,
        "conditions": {}
      }
    ],
    "coverage": {
      "format": "aps-c"
    },
    "opticalConstruction": {
      "groups": 7,
      "elements": 8
    },
    "specialElements": [
      {
        "types": [
          "low-dispersion"
        ],
        "quantity": 2,
        "officialName": "UD"
      }
    ],
    "coatings": null,
    "focus": {
      "autofocus": {
        "present": false
      },
      "manualFocus": {
        "present": true,
        "mechanism": null
      },
      "opticalFocusingSystems": null,
      "minimumFocusDistances": [
        {
          "distanceM": 0.17,
          "conditions": {}
        }
      ],
      "reproductionMagnifications": [
        {
          "kind": "maximum",
          "value": 1,
          "conditions": {}
        }
      ],
      "officialFocusBehaviorClaims": []
    },
    "stabilization": {
      "present": false
    },
    "specialized": {
      "macro": {
        "workingDistances": null
      }
    }
  }
}
