{
  "$schema": "../../../../schemas/lenses/product-record.schema.json",
  "id": "viltrox-af-50mm-f1p8",
  "productType": "lens",
  "identity": {
    "manufacturerId": "viltrox",
    "brandId": "viltrox",
    "productName": "AF 50mm F1.8",
    "modelNumberOptions": null,
    "alternateNames": null,
    "variants": null
  },
  "lifecycle": {
    "announcementDate": null,
    "officialDesignations": []
  },
  "officialProductPages": [],
  "mount": {
    "systemId": "nikon-z",
    "replaceability": "fixed",
    "mountOwnerRelationship": null,
    "electronicContacts": {
      "present": true,
      "metadataTransmission": {
        "present": true,
        "standards": [
          "exif"
        ]
      }
    }
  },
  "physical": {
    "dimensionMeasurements": null,
    "weightMeasurements": null,
    "officialEnvironmentalProtectionClaims": null,
    "filterInterfaces": null,
    "tripodSupport": null,
    "externalLengthDuringFocus": "constant",
    "isRetractableForStorage": null
  },
  "controls": [
    {
      "type": "focus-ring",
      "quantity": 1
    },
    {
      "type": "aperture-ring",
      "quantity": 1
    }
  ],
  "accessories": null,
  "electronicServices": {
    "hasPublishedFirmwareUpdate": true,
    "connections": [
      {
        "method": "direct-usb",
        "purposes": [
          "firmware-update"
        ]
      }
    ]
  },
  "lens": {
    "focalLength": {
      "kind": "prime",
      "millimeters": 50
    },
    "aperture": {
      "fNumber": {
        "maximumAperture": [
          {
            "value": 1.8,
            "conditions": {}
          }
        ],
        "minimumAperture": [
          {
            "value": 16,
            "conditions": {}
          }
        ],
        "effective": null
      },
      "diaphragm": {
        "present": true,
        "bladeCount": null,
        "bladeShape": null
      },
      "controlMechanism": "electronic"
    },
    "anglesOfView": null,
    "coverage": {
      "format": "full-frame"
    },
    "opticalConstruction": null,
    "specialElements": null,
    "coatings": null,
    "focus": {
      "autofocus": {
        "present": true,
        "motors": [
          {
            "type": "stepping-motor",
            "quantity": null,
            "officialName": "STM"
          }
        ]
      },
      "manualFocus": {
        "present": true,
        "mechanism": null
      },
      "opticalFocusingSystems": [
        {
          "type": "internal-focusing",
          "officialName": "Internal focus"
        }
      ],
      "minimumFocusDistances": null,
      "reproductionMagnifications": null,
      "officialFocusBehaviorClaims": null
    },
    "stabilization": {
      "present": false
    },
    "specialized": {}
  }
}
